ID|USER|TARGET|MENTION|POLARITY|INFO|MESSAGE|TAGGED
68770406823239680|251529644|"jsocrates"|"socrates"|-1|"Targets: louçã,socrates;Heavy Punctuation: !!! "|"#debate o Louçã está com cara de ressaca!!! ainda não recuperou da festa, depois da tareia que deu ao Socrates!!"|"#debate o louçã está com cara de ressaca!!! ainda não recuperou da festa, depois da tareia que deu ao socrates!!"
68770262174269440|36664941|"jsocrates"|"sócrates"|-1|"Targets: sócrates;Regra "[VCOP] [Adj-] ? Neg""->  foi assassino "|"@bifeahcasa Epa, a serio. Mt bem, Hitler foi assassino e criminoso, mas no q toca a manietar a nação, Sócrates e Hitler nem são mt diferents"|"@bifeahcasa epa, a serio. mt bem, hitler foi assassino e criminoso, mas no q toca a manietar a nação, sócrates e hitler nem são mt diferents"
68770016312561664|232855418|"jsocrates"|"socras"|-1|"Targets: socras;Nickname: socras"|"O Socras é o fantasma por isso é que o catroga diz que anda a dormir malRT @AldaTelles: A começar "o #debat… (cont) http://deck.ly/~zUNjB"|"o socras é o fantasma por isso é que o catroga diz que anda_a_dormir malrt @aldatelles: a começar "o #debat… (cont) http://deck.ly/~zunjb"
68769935890976769|37636997|"jsocrates"|"sócrates"|0|"Targets: sócrates; sentiTokens:melhor(0) esquerda(0) ; score:0;"|"RT @AldaTelles: A começar "o #debate da esquerda". Ou seja, "eu bato melhor no Sócrates do que tu"."|"rt @aldatelles: a começar "o #debate da esquerda". ou seja, "eu bato melhor no sócrates do que tu"."
68769782685634560|21648020|"jsocrates"|"sócrates"|0|"Targets: sócrates; sentiTokens:melhor(0) esquerda(0) ; score:0;"|"A começar "o #debate da esquerda". Ou seja, "eu bato melhor no Sócrates do que tu"."|"a começar "o #debate da esquerda". ou seja, "eu bato melhor no sócrates do que tu"."
68769593841303552|53149244|"jsocrates"|"sócrates"|0|"Targets: sócrates; sentiTokens:acelerado(0) ; score:0;"|"RT @hsmendes: catroga diz que anda "acelerado", reconhece. daí as comparações de sócrates com hitler em várias entrevistas. okay."|"rt @hsmendes: catroga diz que anda "acelerado", reconhece. daí as comparações de sócrates com hitler em várias entrevistas. okay."
68769307584249856|17087162|"jsocrates"|"sócrates"|0|"Targets: louçã,sócrates; sentiTokens:; score:0;"|"#debate começa com a pergunta: "Porquê votar no BE em vez de votar no PCP e vice-versa», mas Louçã começa a falar de Sócrates"|"#debate começa com a pergunta: "porquê votar no be em vez de votar no pcp e vice-versa», mas louçã começa a falar de sócrates"
68769238084620288|42029230|"jsocrates"|"sócrates"|-1|"Targets: sócrates; sentiTokens:falsidade(-1) politica(0) manipulação(-1) mentiroso(-1) ; score:-3;"|"o BE e CDS fazem politica na base da manipulação e da falsidade e o mentiroso é Sócrates"|"o be e cds fazem politica na base da manipulação e da falsidade e o mentiroso é sócrates"
68769193939570688|36664941|"jsocrates"|"sócrates"|-1|"Targets: sócrates; sentiTokens:são(1) mentirosos(-1) problema(-1) ; score:-1;"|"N consigo perceber o problema de comparar Hitler a Sócrates. Porquê tanta celeuma? São dois mentirosos carismáticos. Separem as coisas..."|"n consigo perceber o problema de comparar hitler a sócrates. porquê tanta celeuma? são dois mentirosos carismáticos. separem as coisas..."
68768876283965440|18896151|"jsocrates"|"sócrates"|0|"Targets: louçã,sócrates,ppc; sentiTokens:jerónimo(0) ; score:0;"|"#debate Louçã afirmou ontem a Sócrates que não falava de PPC, mas abre o debate com Jerónimo a falar de Sócrates..."|"#debate louçã afirmou ontem a sócrates que não falava de ppc, mas abre o debate com jerónimo a falar de sócrates..."
68768747896311808|232855418|"jsocrates"|"sócrates"|0|"Targets: louçã,sócrates; sentiTokens:; score:0;"|"O debate é de Louçã com Sócrates, nem olha para oJerónimo"|"o debate é de louçã com sócrates, nem olha para ojerónimo"
68768591180337153|11862072|"jsocrates"|"sócrates"|-1|"Targets: sócrates; sentiTokens:mentira(-1) ; score:-1;"|"#debate Loução pretende continuar o debate de ontem. Percebe-se. Ontem desmascarou mais uma mentira de Sócrates."|"#debate loução pretende continuar o debate de ontem. percebe-se. ontem desmascarou mais uma mentira de sócrates."
68768552932474880|20597486|"jsocrates"|"sócrates"|0|"Targets: louçã,sócrates; sentiTokens:; score:0;"|"#debate louçã debate com sócrates."|"#debate louçã debate com sócrates."
68768489116147712|19034835|"jsocrates"|"sócrates"|0|"Targets: louçã,sócrates; sentiTokens:; score:0;"|"#debate louçã tenta prolongar efeito da TSU do debate que teve ontem com sócrates"|"#debate louçã tenta prolongar efeito da tsu do debate que teve ontem com sócrates"
68768068926586880|22176845|"jsocrates"|"sócrates"|0|"Targets: sócrates; sentiTokens:; score:0;"|"Nã9 faz sentido desmentir isto. RT @DiogoCMoreira: Catroga diz que Sócrates não tem condiçōea psicológicas para o cargo de PM. Aguardamos de"|"nã9 faz sentido desmentir isto. rt @diogocmoreira: catroga diz que sócrates não tem condiçōea psicológicas para o cargo de pm. aguardamos de"
68767979868925952|36664941|"jsocrates"|"sócrates"|1|"Targets: sócrates; sentiTokens:certo(1) mentirosos(-1) democracia(1) ; score:1;"|"@AldaTelles Certo. E por isso acredito que Sócrates não tem lugar na nossa Democracia. Não precisamos de mentirosos."|"@aldatelles certo. e por isso acredito que sócrates não tem lugar na nossa democracia. não precisamos de mentirosos."
68764280220155904|19534202|"jsocrates"|"sócrates"|0|"Targets: sócrates; sentiTokens:acelerado(0) ; score:0;"|"RT "@hsmendes: catroga diz que anda "acelerado", reconhece. daí as comparações de sócrates com hitler em várias entrevistas. okay.""|"rt "@hsmendes: catroga diz que anda "acelerado", reconhece. daí as comparações de sócrates com hitler em várias entrevistas. okay.""
68764040326938625|20627896|"jsocrates"|"sócrates"|-1|"Targets: sócrates; sentiTokens:desmentido(-1) ; score:-1;"|"Por outras palavras, Catroga acaba de dizer que Sócrates não tem condiçōea psicológicas para o cargo de PM. Aguardamos desmentido do PSD."|"por outras palavras, catroga acaba de dizer que sócrates não tem condiçōea psicológicas para o cargo de pm. aguardamos desmentido do psd."
68763900417544192|36664941|"jsocrates"|"socrates"|-1|"Targets: socrates; sentiTokens:diferentes(0) mentira(-1) ; score:-1;"|"@AldaTelles A questão é que Catroga tem alguma razão. Em escalas diferentes claro, mas Hitler e Socrates partilham a mentira compulsiva..."|"@aldatelles a questão é que catroga tem alguma razão. em escalas diferentes claro, mas hitler e socrates partilham a mentira compulsiva..."
68763621315981312|20627896|"jsocrates"|"sócrates"|0|"Targets: sócrates; sentiTokens:preocupado(0) ; score:0;"|"Catroga está preocupado com o perfil psicológico de Sócrates."|"catroga está preocupado com o perfil psicológico de sócrates."
68762943084433408|8662472|"jsocrates"|"sócrates"|0|"Targets: sócrates; sentiTokens:; score:0;"|"Como é que os troikos conseguem ouvir Sócrates dizer "Nós vamos cumprir o acordo" sem se rirem?"|"como é que os troikos conseguem ouvir sócrates dizer "nós vamos cumprir o acordo" sem se rirem?"
68760740894486529|22905057|"jsocrates"|"sócrates"|0|"Targets: sócrates; sentiTokens:; score:0;"|"Coelho não vê diferenças entre Jardim e Sócrates: O cabeça-de-lista do PTP, José Manuel Coelho, disse esta... http://tinyurl.com/3ebk3xj"|"coelho não vê diferenças entre jardim e sócrates: o cabeça-de-lista do ptp, josé_manuel_coelho, disse esta... http://tinyurl.com/3ebk3xj"
68759690347151360|86429346|"jsocrates"|"sócrates"|0|"Targets: sócrates; sentiTokens:críticas(0) ; score:0;"|"RT @cachimbo: Quis ir buscar lã e saiu tosquiado: aconteceu a Sócrates com as críticas histéricas à proposta do PSD ... http://bit.ly/kaWlSZ"|"rt @cachimbo: quis ir buscar lã e saiu tosquiado: aconteceu a sócrates com as críticas histéricas à proposta do psd ... http://bit.ly/kawlsz"
68759568926257152|18920461|"jsocrates"|"josé sócrates"|0|"Targets: pedro passos coelho,josé sócrates; sentiTokens:; score:0;"|"Quem faz mais barulho?: Pedro Passos Coelho diz que com a atitude de José Sócrates Portugal arrisca-se a reestru... http://bit.ly/k6L88M"|"quem faz mais barulho?: pedro_passos_coelho diz que com a atitude de josé_sócrates portugal arrisca-se a reestru... http://bit.ly/k6l88m"
68759494204731392|251529644|"jsocrates"|"socrates"|1|"Targets: socrates; sentiTokens:bonito(1) ; score:1;"|"#depilação O socrates cortou o cabelo!! que bonito!!"|"#depilação o socrates cortou o cabelo!! que bonito!!"
68758430764122113|18842676|"jsocrates"|"sócrates"|0|"Targets: sócrates; sentiTokens:críticas(0) ; score:0;"|"Quis ir buscar lã e saiu tosquiado: Foi o que aconteceu a Sócrates com as críticas histéricas à proposta do PSD ... http://bit.ly/kaWlSZ"|"quis ir buscar lã e saiu tosquiado: foi o que aconteceu a sócrates com as críticas histéricas à proposta do psd ... http://bit.ly/kawlsz"
68758414427295744|50329936|"jsocrates"|"sócrates"|-1|"Targets: sócrates; sentiTokens:seria(0) comentadores(0) mentiroso(-1) ; score:-1;"|"Agor, que se confirmou que não havia carta nenhuma, os comentadores que chamaram mentiroso a Sócrates vão retratar-se? Seria o mínimo..."|"agor, que se confirmou que não havia carta nenhuma, os comentadores que chamaram mentiroso a sócrates vão retratar-se? seria o mínimo..."
68758185850314752|18187582|"jsocrates"|"sócrates"|1|"Targets: sócrates; sentiTokens:são(1) ; score:1;"|"@linaaaa @Cibereconomia nesta arte o sócrates&comitiva são exímios"|"@linaaaa @cibereconomia nesta arte o sócrates&comitiva são exímios"
68757788460986368|28084957|"jsocrates"|"socrates"|0|"Targets: socrates; sentiTokens:lider(0) ; score:0;"|"Estás a pensar votar Socrates? Apoia o teu lider http://t.co/jHnrne4 e vai com ele para a http://t.co/OgRQ9DV"|"estás a pensar votar socrates? apoia o teu lider http://t.co/jhnrne4 e vai com ele para a http://t.co/ogrq9dv"
68757685587292161|20627896|"jsocrates"|"sócrates"|0|"Targets: louçã,sócrates; sentiTokens:; score:0;"|"Afinal a "carta" que Louçã referiu no debate com Sócrates não existe. Talvez seja o memorando, talvez não."|"afinal a "carta" que louçã referiu no debate com sócrates não existe. talvez seja o memorando, talvez não."
68757159873216512|42011097|"jsocrates"|"sócrates"|0|"Targets: louçã,sócrates; sentiTokens:; score:0;"|"[Publico]  Louçã confrontou Sócrates com carta de garantias ao FMI, garante BE http://goo.gl/fb/xoqUU"|"[publico]  louçã confrontou sócrates com carta de garantias ao fmi, garante be http://goo.gl/fb/xoquu"
68756932026040321|52053647|"jsocrates"|"sócrates"|0|"Targets: sócrates; sentiTokens:; score:0;"|"#sábado Mira Amaral: Sócrates "não leu texto que assinou com 'troika": O economista Luís Mira Amaral considerou ... http://bit.ly/mG2ETP"|"#sábado mira amaral: sócrates "não leu texto que assinou com 'troika": o economista luís_mira_amaral considerou ... http://bit.ly/mg2etp"
68755418213654528|19396039|"jsocrates"|"sócrates"|0|"Targets: sócrates; sentiTokens:nada(0) ; score:0;"|"Video: Esta é para o Joselito Sócrates. (As minhas aulas de música não eram nada disto) http://tumblr.com/xv62hqwuw1"|"video: esta é para o joselito sócrates. (as minhas aulas de música não eram nada disto) http://tumblr.com/xv62hqwuw1"
68752987413164032|22905057|"jsocrates"|"sócrates"|0|"Targets: sócrates,louçã; sentiTokens:esquerda(0) ; score:0;"|"Louçã confrontou Sócrates com a carta de garantias ao FMI: O Bloco de Esquerda afirmou hoje que Louçã conf... http://tinyurl.com/44uf3mo"|"louçã confrontou sócrates com a carta de garantias ao fmi: o bloco de esquerda afirmou hoje que louçã conf... http://tinyurl.com/44uf3mo"
69113472742465536|17063215|"pportas"|"paulo portas"|0|"Targets: passos coelho,paulo portas; sentiTokens:; score:0;"|"Acompanhe o #debate entre Passos Coelho e Paulo Portas no tvi24.pt AO MINUTO"|"acompanhe o #debate entre passos_coelho e paulo_portas no tvi24.pt ao minuto"
69112021962063873|19019970|"pportas"|"portas"|0|"Targets: portas; sentiTokens:; score:0;"|"O Minuto a Minuto Passos - Portas já está online. Deixe o seu comentário no site do Parlamento Global!"|"o minuto a minuto passos - portas já está online. deixe o seu comentário no site do parlamento global!"
69098003511779329|17163446|"pportas"|"portas"|1|"Targets: passos coelho,portas; sentiTokens:especial(1) nova(0) ; score:1;"|"Debate Passos Coelho-Paulo Portas em nova operação especial Parlamento Global- SIC Notícias http://ow.ly/4U5Rt"|"debate passos_coelho-paulo portas em nova operação especial parlamento global- sic notícias http://ow.ly/4u5rt"
69085119561990144|229516891|"pportas"|"portas"|0|"Targets: portas; sentiTokens:politica(0) ; score:0;"|"RT @juditefranca: Siga ao debate AO MINUTO http://www.tvi24.iol.pt/politica/passos-coelho-psd-portas-cds-debate--ao-minuto/1253110-4072. ..."|"rt @juditefranca: siga ao debate ao minuto http://www.tvi24.iol.pt/politica/passos-coelho-psd-portas-cds-debate--ao-minuto/1253110-4072. ..."
69078615895195648|16406687|"pportas"|"portas"|0|"Targets: portas; sentiTokens:; score:0;"|"RT @bibliotecasUA: Notícias Biblioteca Comunidade académica convidada a comentar «Minuto a Minuto» debate Passos-Portas http://tinyurl.c ..."|"rt @bibliotecasua: notícias biblioteca comunidade académica convidada a comentar «minuto a minuto» debate passos-portas http://tinyurl.c ..."
69076111509819392|17087856|"pportas"|"portas"|0|"Targets: portas; sentiTokens:; score:0;"|"#debate Debate Passos vs Portas: a análise online e no TVI24 http://bit.ly/m4zRH1"|"#debate debate passos vs portas: a análise online e no tvi24 http://bit.ly/m4zrh1"
69071330187808768|14284888|"pportas"|"paulo portas"|0|"Targets: paulo portas,passos coelho; sentiTokens:; score:0;"|"#apombalivre:  #FMI: Hoje é dia do Paulo portas ir ajudar o Passos coelho a fazer de conta de que não é de extrema direita. Triade"|"#apombalivre:  #fmi: hoje é dia do paulo_portas ir ajudar o passos_coelho a fazer de conta de que não é de extrema direita. triade"
69071230619238402|53149244|"pportas"|"portas"|-1|"Targets: portas;Quoted sentiment:  "ele canta_de_galo mas não passa de um garnizé"."|"Miguel Veiga sobre Portas: "Ele canta de galo mas não passa de um garnizé". Não esperemos encontrar modelos de vida na política portuguesa."|"miguel veiga sobre portas: "ele canta_de_galo mas não passa de um garnizé". não esperemos encontrar modelos de vida na política portuguesa."
69070083661627392|34076997|"pportas"|"portas"|-1|"Targets: portas; sentiTokens:tristes(-1) ; score:-1;"|"Mas já não há Catroga. Voltamos às noites tristes. RT @CarlosLima7: Hoje há Passos-Portas, não é?"|"mas já não há catroga. voltamos às noites tristes. rt @carloslima7: hoje há passos-portas, não é?"
69069652000645120|21424725|"pportas"|"portas"|-1|"Targets: portas; sentiTokens:escondidos(-1) ; score:-1;"|"Vamos lá ver se hoje Passos e Portas assumem a, politicamente falando, união de facto ou preferem continuar escondidos no armário"|"vamos lá ver se hoje passos e portas assumem a, politicamente falando, união de facto ou preferem continuar escondidos no armário"
69067281866555392|21409325|"pportas"|"portas"|-1|"Targets: portas; sentiTokens:escancarado(-1) ; score:-1;"|"@cmmareco janelas e portas... tudo escancarado..."|"@cmmareco janelas e portas... tudo escancarado..."
69060215219306496|184559953|"pportas"|"paulo portas"|0|"Targets: paulo portas; sentiTokens:; score:0;"|"RT @antena1politica: Paulo Portas quer evitar aumento da taxa máxima do IVA e IRS mais "amigo das famílias" http://dlvr.it/RG6w1"|"rt @antena1politica: paulo_portas quer evitar aumento da taxa máxima do iva e irs mais "amigo das famílias" http://dlvr.it/rg6w1"
69057656777744384|30235308|"pportas"|"portas"|0|"Targets: portas; sentiTokens:; score:0;"|"Notícias Biblioteca Comunidade académica convidada a comentar «Minuto a Minuto» debate Passos-Portas http://tinyurl.com/3vbpocs"|"notícias biblioteca comunidade académica convidada a comentar «minuto a minuto» debate passos-portas http://tinyurl.com/3vbpocs"
69055268771737601|43901270|"pportas"|"paulo portas"|0|"Targets: paulo portas; sentiTokens:melhor(0) ; score:0;"|"Novo Post: Melhor do que um Paulo Portas...: ...só DOIS Paulo Portas! http://bit.ly/ieuBfM"|"novo post: melhor do que um paulo_portas...: ...só dois paulo_portas! http://bit.ly/ieubfm"
69049565688508416|233292368|"pportas"|"paulo portas"|0|"Targets: paulo portas; sentiTokens:; score:0;"|"Habilidades que Paulo Portas aprendeu na Irlanda http://t.co/xCfQ3Fb"|"habilidades que paulo_portas aprendeu na irlanda http://t.co/xcfq3fb"
69047281634115584|233292368|"pportas"|"portas"|-1|"Targets: portas; sentiTokens:populista(-1) deputados(0) ; score:-1;"|"Paulo Portas n quer férias para os deputados.Errado.Para ser populista devia incentivar deputados a férias em Portugal #Turismo #Crescimento"|"paulo portas n quer férias para os deputados.errado.para ser populista devia incentivar deputados a férias em portugal #turismo #crescimento"
69038962840322048|42029230|"pportas"|"portas"|0|"Targets: louçã,sócrates,portas; sentiTokens:jerónimo(0) ; score:0;"|"o debates entre Louçã e Jerónimo está para Sócrates como os debates entre Passos e Portas, todos contra 1, em q esse 1 pode com eles todos"|"o debates entre louçã e jerónimo está para sócrates como os debates entre passos e portas, todos contra 1, em q esse 1 pode com eles todos"
69037300373389312|251529644|"pportas"|"portas"|0|"Targets: portas,ppc; sentiTokens:; score:0;"|"@AgataClerigo portas VS PPC... Promete!"|"@agataclerigo portas vs ppc... promete!"
69036597806514176|19334929|"pportas"|"paulo portas"|0|"Targets: paulo portas,pedro passos coelho; sentiTokens:; score:0;"|"Hoje às 20.45H na SIC. Debate - Paulo Portas vs Pedro Passos Coelho."|"hoje às 20.45h na sic. debate - paulo_portas vs pedro_passos_coelho."
69034668523143168|36126027|"pportas"|"portas"|0|"Targets: portas; sentiTokens:velha(0) ; score:0;"|"RT @ILoveMadeira: Tens passado pela Zona Velha ultimamente? existe um projecto em curso que tem como ideia pintar 200 das portas... http ..."|"rt @ilovemadeira: tens passado pela zona velha ultimamente? existe um projecto em curso que tem como ideia pintar 200 das portas... http ..."
69032310288293888|164717156|"pportas"|"portas"|0|"Targets: portas; sentiTokens:velha(0) ; score:0;"|"Tens passado pela Zona Velha ultimamente? existe um projecto em curso que tem como ideia pintar 200 das portas... http://fb.me/QNmbEgUn"|"tens passado pela zona velha ultimamente? existe um projecto em curso que tem como ideia pintar 200 das portas... http://fb.me/qnmbegun"
69025369310773249|51679632|"pportas"|"portas"|0|"Targets: socrates,portas; sentiTokens:; score:0;"|"COELHO ESPERA SOCRATES E PORTAS NA TVI  http://youtu.be/0qqSv9T-Lj0"|"coelho espera socrates e portas na tvi  http://youtu.be/0qqsv9t-lj0"
69008895946932224|14460422|"pportas"|"portas"|-1|"Targets: portas;Smiley: . :)"|"@the_geeek Pois logo vi... Andas a submarinar, à lá portas... :)"|"@the_geeek pois logo vi... andas a submarinar, à lá portas... :)"
68977062643380224|18920461|"pportas"|"paulo portas"|0|"Targets: passos coelho,paulo portas; sentiTokens:; score:0;"|"Debate entre Passos Coelho e Paulo Portas: antevisão, comentários e análise a partir das 19:00: Hoje, a partir d... http://bit.ly/mAMUzO"|"debate entre passos_coelho e paulo_portas: antevisão, comentários e análise a partir das 19:00: hoje, a partir d... http://bit.ly/mamuzo"
68970626647465984|17163446|"pportas"|"portas"|1|"Targets: passos coelho,portas; sentiTokens:especial(1) nova(0) ; score:1;"|"Debate Passos Coelho-Paulo Portas em nova operação especial Parlamento Global-SIC Notícias  http://ow.ly/4THvs"|"debate passos_coelho-paulo portas em nova operação especial parlamento global-sic notícias  http://ow.ly/4thvs"
68847581526110208|17610324|"pportas"|"portas"|0|"Targets: portas; sentiTokens:jovem(0) ; score:0;"|"@helderlib E o Portas, também é jovem?"|"@helderlib e o portas, também é jovem?"
68833240374456320|292019076|"pportas"|"paulo portas"|-1|"Targets: paulo portas;Haha: ahahahahahah,"|"RT @fcancio: 'paulo portas ñ fez trapalhada nenhuma', diz lobo xavier. ahahahahahah, aquilo do gráfico ñ foi trapalhada, foi d propósito ..."|"rt @fcancio: 'paulo_portas ñ fez trapalhada nenhuma', diz lobo xavier. ahahahahahah, aquilo do gráfico ñ foi trapalhada, foi d propósito ..."
68821268845166593|14955385|"pportas"|"paulo portas"|-1|"Targets: paulo portas;Haha: ahahahahahah,"|"RT @fcancio: 'paulo portas ñ fez trapalhada nenhuma', diz lobo xavier. ahahahahahah, aquilo do gráfico ñ foi trapalhada, foi d propósito ..."|"rt @fcancio: 'paulo_portas ñ fez trapalhada nenhuma', diz lobo xavier. ahahahahahah, aquilo do gráfico ñ foi trapalhada, foi d propósito ..."
68819427386339328|20345378|"pportas"|"paulo portas"|0|"Targets: paulo portas; sentiTokens:; score:0;"|"«Habilidades que Paulo Portas aprendeu na Irlanda» (blogpost) http://t.co/h9jp6m4 via @AddThis"|"«habilidades que paulo_portas aprendeu na irlanda» (blogpost) http://t.co/h9jp6m4 via @addthis"
68803571705053184|20470593|"pportas"|"portas"|1|"Targets: portas; sentiTokens:bons(1) ; score:1;"|"Hospital Miguel Bombarda fecha portas esta semana http://bit.ly/kTuSfX ... logo agora com tantos e tão bons ca… (cont) http://deck.ly/~zta0D"|"hospital miguel bombarda fecha portas esta semana http://bit.ly/ktusfx ... logo agora com tantos e tão bons ca… (cont) http://deck.ly/~zta0d"
68792323470925824|17745219|"pportas"|"portas"|0|"Targets: portas; sentiTokens:velho(0) ; score:0;"|"@ZW3I @Rui_Castro um CDS governo é possível que fizesse isso tudo. Olha à volta do Portas (ele é o mais velho)"|"@zw3i @rui_castro um cds governo é possível que fizesse isso tudo. olha à volta do portas (ele é o mais velho)"
68780355276115968|17610324|"pportas"|"portas"|0|"Targets: portas; sentiTokens:liberal(0) ; score:0;"|"@Rui_Castro Imaginemos que o Portas ia para primeiro-ministro. Ia ser liberal? Claro que não. Ia baixar a despesa do Estado? Claro que não."|"@rui_castro imaginemos que o portas ia para primeiro-ministro. ia ser liberal? claro que não. ia baixar a despesa do estado? claro que não."
68771806479265792|53149244|"pportas"|"portas"|0|"Targets: portas; sentiTokens:; score:0;"|"RT @margvs: Não sei se repararam, mas Portas discorda das contas do PSD sobre tsu."|"rt @margvs: não sei se repararam, mas portas discorda das contas do psd sobre tsu."
68770710054641667|23011527|"pportas"|"paulo portas"|0|"Targets: paulo portas; sentiTokens:jerónimo(0) ; score:0;"|"#debate Jerónimo quando fala de patriotismo só me lembra o Paulo Portas"|"#debate jerónimo quando fala de patriotismo só me lembra o paulo_portas"
68753149221027840|19313895|"pportas"|"portas"|-1|"Targets: portas; sentiTokens:mentiroso(-1) ; score:-1;"|"Paulo Portas o Mentiroso: Share on Facebook http://bit.ly/lWCcNe"|"paulo portas o mentiroso: share on facebook http://bit.ly/lwccne"
68975575175409664|20701487|"jsousa"|"jerónimo de sousa"|0|"Targets: jerónimo de sousa; sentiTokens:; score:0;"|"Programa da troika é «agressão ao povo e ao país», afirma Jerónimo de Sousa http://bit.ly/mUwxa0"|"programa da troika é «agressão ao povo e ao país», afirma jerónimo_de_sousa http://bit.ly/muwxa0"
68950871270109184|20781852|"jsousa"|"jerónimo de sousa"|0|"Targets: jerónimo de sousa,louçã; sentiTokens:críticas(0) ; score:0;"|"Eleições: Jerónimo de Sousa e Louçã coincidem nas críticas ao PS http://dstk.me/OkQ"|"eleições: jerónimo_de_sousa e louçã coincidem nas críticas ao ps http://dstk.me/okq"
68938471141675008|165862297|"jsousa"|"jeronimo de sousa"|0|"Targets: jeronimo de sousa; sentiTokens:; score:0;"|"http://www.youtube.com/watch?v=s__kAkZ08Ys debate Louça e Jeronimo de Sousa"|"http://www.youtube.com/watch?v=s__kakz08ys debate louça e jeronimo_de_sousa"
68811598516588544|107181968|"jsousa"|"jerónimo de sousa"|0|"Targets: jerónimo de sousa,francisco louçã; sentiTokens:; score:0;"|"http://planetacultural.blogs.sapo.pt/1168062.html Jerónimo de Sousa vs Francisco Louçã"|"http://planetacultural.blogs.sapo.pt/1168062.html jerónimo_de_sousa vs francisco_louçã"
68808036902387712|71650592|"jsousa"|"jerónimo de sousa"|1|"Targets: louçã,francisco louçã,jerónimo de sousa; sentiTokens:jerónimo(0) segurança(1) ; score:1;"|"[TSF]: Louçã e Jerónimo recuperam Segurança Social: Na RTP, Francisco Louçã e Jerónimo de Sousa realizaram debat... http://bit.ly/kYP0Xe"|"[tsf]: louçã e jerónimo recuperam segurança social: na rtp, francisco_louçã e jerónimo_de_sousa realizaram debat... http://bit.ly/kyp0xe"
68803414867456000|152957952|"jsousa"|"jerónimo de sousa"|0|"Targets: jerónimo de sousa; sentiTokens:; score:0;"|"Legislativas (5):     DEBATE JERÓNIMO DE SOUSA-FRANCISCO LOUÇÃ   Debate? Que debate? Quem teve a paciência de es... http://bit.ly/mnX0Lj"|"legislativas (5):     debate jerónimo_de_sousa-francisco louçã   debate? que debate? quem teve a paciência de es... http://bit.ly/mnx0lj"
68797002602913792|24311786|"jsousa"|"jerónimo de sousa"|0|"Targets: jerónimo de sousa; sentiTokens:; score:0;"|"Legislativas (5):     DEBATE JERÓNIMO DE SOUSA-FRANCISCO LOUÇÃ   Debate? Que debate? Quem teve a paciência de es... http://bit.ly/iBmMFI"|"legislativas (5):     debate jerónimo_de_sousa-francisco louçã   debate? que debate? quem teve a paciência de es... http://bit.ly/ibmmfi"
