2011-05-13\2011-05-14|69410493957287900|19722435|jsocrates|josé sócrates|-1|Então já havia CRISE?! @Lusa_noticias: "Ganância pelo poder fez o PSD acrescentar à crise económica uma crise política" - José Sócrates""
2011-05-13\2011-05-14|69440749812449200|266828775|jsocrates|sócrates|-1|Então? Foi desta que Sócrates apresentou alguma medida do seu programa? O programa do PS podia estar na pasta vazia que mostrou ao Portas!!
2011-05-13\2011-05-14|69334635557027800|22176845|pportas|portas|-1|Esses 14.000 milhões de euros de que fala Portas não existem. #cdspp
2011-05-13\2011-05-14|69337377537134500|22176845|pportas|portas|-1|Este discurso de Portas é uma desilusão. Quer um estado intervencionista, quer meter-se na vida das empresas e não há uma medida difícil.
2011-05-13\2011-05-14|69128877963882400|22147976|jsocrates|sócras|-1|Este passos conejo tem uma ladaínha irritante cunó caralho #debate mas a do sócras é claramente pior e já tá mais gasta có caralho
2011-05-13\2011-05-14|69451163472371700|105898722|jsocrates|josé sócrates|-1|Estes falam em Hitler e Sócrates é que aposta no medo. ROTFL RT @Publico: PPC acusa José Sócrates de apostar numa “estratégia de medo”
2011-05-13\2011-05-14|69163671821103100|257992237|jsocrates|josé sócrates|-1|Foi só a primeira mentira RT @pedromamede Mas afinal José Sócrates tinha avisado...  a entrevista que ningué… (cont) http://deck.ly/~lodI8
2011-05-13\2011-05-14|69476652618498000|19722435|jsocrates|sócrates|-1|Haja paciência @jcaetanodias: LOL Desta nem Sócrates se lembrava. RT @mariomtteixeira: P.Coelho não sabe fazer mais nada a não...""
2011-05-13\2011-05-14|69378563270385600|22176845|jsocrates|josé sócrates|-1|Hein? RT @Lusa_noticias: Estamos nesta campanha para enfrentar a crise, como sempre fez o PS - José Sócrates
2011-05-13\2011-05-14|69458107339780000|234095105|jsocrates|sócrates|-1|Incrível as sondagens dão o Sócrates como futuro primeiro-ministro. O país na banca-rota, a maior carga fiscal de sempre... e acordar não?
2011-05-13\2011-05-14|69369539615408100|71932014|pportas|portas|-1|Interessante: o PPC faz uma pausa por Portas não olhar o adversário de frente. O PSD devia ter comentadores a explorar isto.
2011-05-13\2011-05-14|69462272182980600|29456169|jsocrates|sócrates|-1|Irão adiou pena sharia que cegaria homem. Se a lei islâmica prevalecesse por estas bandas, Sócrates teria assinado o memorando com os pés.
2011-05-13\2011-05-14|69331907078402000|14975487|pportas|paulo portas|-1|Li e Gostei: da sonsice - Assim de repente não me lembro de ter ouvido Paulo Portas, no seu terceiro debate e a 22 d... http://ow.ly/1cEY8z
2011-05-13\2011-05-14|69115411165229000|62541160|flouca|louçã|-1|Louçã pede um abanão eleitoral" (jnegocios). Concordo a 100%. Faço votos q nesta eleição Louçã sofra abanão e perceba q se deve reformar"
2011-05-13\2011-05-14|69342483221446600|13820922|flouca|louçã|-1|Louçã: "Devemos renegociar a dívida, já!"" - ah! estas mentes brilhantes! vamos já dizer a todos que não vamos pagar, vamos?"
2011-05-13\2011-05-14|69206755833421800|17637572|jsocrates|sócrates|-1|Mas já sei, no fim, o argumento é: sócrates rouba-nos!""
2011-05-13\2011-05-14|69143088798515200|74982972|jsocrates|sócrates|-1|Na minha terra tb é |) RT @ZW3I: @AsdePaus Dizer de alguém que ele vota Sócrates é um insulto, pá.
2011-05-13\2011-05-14|69391369529081800|19314019|jsocrates|sócrates|-1|nada de novo, portanto... “@horacioazevedo: Sócrates a confirmar que é o mais preparado para levar um país à bancarrota. #SICN”
2011-05-13\2011-05-14|69393032683864000|70220125|jsocrates|sócrates|-1|Não entendo este país como é possível pensar que o Sócrates vai ganhar as eleições outra vez.
2011-05-13\2011-05-14|69474573166460900|21509510|jsocrates|pinóquio|-1|Não podemos ceder à chantagem do medo montada pela tríade Macau e pelo alucinado Pinóquio das Beiras que lá colocaram. http://fb.me/XP8OIDfC
2011-05-13\2011-05-14|69470836008030200|71678482|jsocrates|josé sócrates|-1|Nao se enxerga RT @aguiarbranco: José Sócrates voltou, hoje, no distrito do Porto a autodenominar-se salvador do estado social
2011-05-13\2011-05-14|69149367545757600|8757362|jsocrates|josé sócrates|-1|No #tugaleaks: José Sócrates diz o dito pelo não dito – COMPILAÇÃO DE FACTOS!: José Sócrates semp... http://bit.ly/kawNCS - por @ruicruz
2011-05-13\2011-05-14|69135227821359100|19088280|ppcoelho|ppc|-1|No 1. Jogo com os seniores" PPC mostra que ainda não aguenta a pedalada dos grandes... Devia ter fica mais uma temporada nos juniores.."
2011-05-13\2011-05-14|69162821002346400|1455261|pportas|portas|-1|No Expresso da Meia Noite confundem CDS com Paulo Portas... CDS no Governo não é Portas no Governo. |-)
2011-05-13\2011-05-14|69134702254096300|44609080|jsocrates|socrates|-1|o #portas domina isto. o único q é tão bom ou melhor é o #socrates (infelizmente :( )
2011-05-13\2011-05-14|69130087462739900|47622979|jsocrates|socrates|-1|Ó Clarinha, quem foi ao bolso aos portugueses foi o Socrates
2011-05-13\2011-05-14|69162978892713900|266828775|jsocrates|sócrates|-1|O PS de Sócrates já apresentou alguma medida, ou continua a falar mal das do PSD?
2011-05-13\2011-05-14|69144990751789000|17610324|jsocrates|sócrates|-1|O Sócrates já negou a recessão (de novo)?
2011-05-13\2011-05-14|69141273898004400|21141462|jsocrates|josé sócrates|-1|O vendedor de automóveis: «Não tenho nada contra José Sócrates. Se ele se limitasse a ser um vendedor de automóv... http://bit.ly/iNVTeb
2011-05-13\2011-05-14|69128630646734800|266828775|jsocrates|sócrates|-1|Oh meus amigos vamos mas é desancar no Sócrates e deixem-se de pintelhos..:)
2011-05-13\2011-05-14|69117316729806800|64788246|jsocrates|socrates|-1|Oh Socrates, és buuurrrooo!!!
2011-05-13\2011-05-14|69401160393560000|8999162|pportas|portas|-1|Paulo Portas criou um novo transporte: o elevador social.  Aguarda-se informação sobre carreiras e horários.
2011-05-13\2011-05-14|69203886338093000|17624543|pportas|portas|-1|paulo portas devia fazer um estágio intensivo de olhar pessoas. há um défice de credibilidade naquela incapacidade de fixar.
2011-05-13\2011-05-14|69387081918578600|84558700|pportas|portas|-1|Paulo Portas: à beira da fraude eleitoral http://maisactual.blogspot.com/2011/05/paulo-portas-beira-da-fraude-eleitoral.html
2011-05-13\2011-05-14|69140248856231900|19290986|jsocrates|sócrates|-1|PENTELHO ENTRE OS DENTES: Mais um frete ao sr. Fraude. Há um pentelho entre os dentes de Portugal. Sócrates. É p... http://bit.ly/lmt70T
2011-05-13\2011-05-14|69426456815616000|17477169|jsocrates|sócrates|-1|Porque é q Sócrates continua a mentir deliberadamente sobre a privatização da CGD acusando PSD de uma intenção q não corresponde à verdade?
2011-05-13\2011-05-14|69337902705950700|22176845|jsocrates|sócrates|-1|Portas aprendeu com Sócrates: a verdade não compensa. Nem vou ver mais para não me chatear.
2011-05-13\2011-05-14|69129083874840500|162089811|jsocrates|sócrates|-1|Portas, nestas eleições, está para PM como Sócrates, nestas eleições, para um gajo que diz a verdade.
2011-05-13\2011-05-14|69119920377577400|34076997|jsocrates|sócrates|-1|Posso comentar: a culpa é do Sócrates. :))  RT @jcaetanodias: Comentou a sondagem da Marktest?
2011-05-13\2011-05-14|69128266769907700|19716185|jsocrates|sócrates|-1|PPC quer o mesmo que Sócrates, a maioria. Espero que não seja para fazer o mesmo.
2011-05-13\2011-05-14|69166946398109600|67283254|jsocrates|sócrates|-1|Pura ganância.: Pura ganância.: O meu sonho de ver Sócrates agrilhoado a uma galera talvez não chegue a cumprir... http://bit.ly/mtPe2p"
2011-05-16\2011-05-17|70544140450009000|27518674|jsocrates|sócrates|-1|_Pôr o Sócrates a gerir os 78 mil milhões é como promover o Bibi a chefe dos escuteiros"."
2011-05-16\2011-05-17|70225879204249600|22208238|jsocrates|sócrates|-1|'O país precisa de uma política com responsabilidade' Sócrates #debate Loool não é a sua de certeza
2011-05-16\2011-05-17|70556486576783300|93847902|jsocrates|sócrates|-1|'Sócrates é o campeão de mudar de opinião' .
2011-05-16\2011-05-17|70423890094075900|22264540|jsocrates|sócrates|-1|“Pôr o Sócrates a gerir os 78 mil milhões é como promover o Bibi a chefe dos escuteiros...” RECEBIDO POR EMAIL :)
2011-05-16\2011-05-17|70443144302444500|162089811|jsocrates|sócrates|-1|@_marioteixeira_ Sócrates nunca teve uma ideia excepto como enganar o parvo"."
2011-05-16\2011-05-17|70493748127207400|125990752|jsocrates|sócrates|-1|@andrealmeida E falta referir, q por causa do endividamento da gov. socialista, o governo socialista de Sócrates arruinou o Estado Social.
2011-05-16\2011-05-17|70219481187745700|219712156|jsocrates|sócrates|-1|@ChicodeOeiras olha que nao. A gravata do Sócrates esta deprimida... Quer enforcar-se no próprio no e nao consegue...
2011-05-16\2011-05-17|70531802627964900|47930935|ppcoelho|ppc|-1|@DonSegismundo ainda se vai descobrir que o PPC tirou o curso nas Novas Oportunidades!
2011-05-16\2011-05-17|70523242208698300|269027164|jsocrates|sócrates|-1|@fitzca Um coveiro precisava prestar concurso em Pt. e para ser o Sócrates só precisa de um diploma duvidoso de engenheiro.
2011-05-16\2011-05-17|70525852068216800|19393139|jsocrates|sócrates|-1|@JMF1957 Sócrates não é egoísta. Um curso igual ao dele para cada português. O Gov. devia manter os RVCC como um instrumento  não politico.
2011-05-16\2011-05-17|70228116286607300|31155470|jsocrates|sócrates|-1|@JoaoJoseBica É verdade, até podia ser uma coligação PSD/CDS/CDU, mas nunca com Sócrates!
2011-05-16\2011-05-17|70496861621989300|255440084|jsocrates|socrates|-1|@Manuel_Teixeira o Socrates devia era estar atras das barras, visto que ir a tribunal nao e para Politicos...
2011-05-16\2011-05-17|70424109732995000|50257616|jsocrates|sócrates|-1|@PauloQuerido E para as mentiras de Sócrates? Um servidor chega?
2011-05-16\2011-05-17|70446111659261900|22147976|pportas|paulo portas|-1|@Pinilla só tou a dizer que quero um cabelo novo como ele meteu. Só não pode ser é à paulo portas. Solarium not for mi either.
2011-05-16\2011-05-17|70404460190507000|217248299|jsocrates|sócrates|-1|@PSDBraga: "Sócrates andou a vender banha da cobra no distrito de Braga" http://bit.ly/iZFFsI""
2011-05-16\2011-05-17|70221469946347500|19393139|jsocrates|sócrates|-1|@rsaraiva A Sócrates não lhe custa nada aldrabar. #debate MoU em Português?
2011-05-16\2011-05-17|70220051139133400|17087856|jsocrates|sócrates|-1|#debate Clara «entala» Sócrates
2011-05-16\2011-05-17|70223697117581300|19682061|jsocrates|sócrates|-1|#debate falta de coragem de Sócrates porque permite abertura continente ao domingo. Sócrates responde com ironia.
2011-05-16\2011-05-17|70226158020599800|11862072|jsocrates|sócrates|-1|#debate Governação séria e competente como a que o PS tem tido. Sócrates acabou de prometer nova bancarrota, caso seja reeleito.
2011-05-16\2011-05-17|70222561098743800|19034835|jsocrates|sócrates|-1|#debate já é a 2 questão da clara de sousa à qual sócrates tenta fugir
2011-05-16\2011-05-17|70219686859636700|11862072|jsocrates|josé sócrates|-1|#debate O debate teve agora um mau momento. A Clara de Sousa falou em inglês não-técnico e José Sócrates não percebeu nada.
2011-05-16\2011-05-17|70222037540552700|23011527|jsocrates|sócrates|-1|#debate olha quem fala! resposta de jerónimo a um é pura demagogia de sócrates""
2011-05-16\2011-05-17|70219806397308900|58832411|jsocrates|socrates|-1|#DEBATE ops Socrates a mentir.foi apanhado
2011-05-16\2011-05-17|70222639523835900|11862072|jsocrates|sócrates|-1|#debate Sócrates a utilizar a palavra honestamente". Não pode estar a falar do seu mandato."
2011-05-16\2011-05-17|70225536626073600|17087856|jsocrates|sócrates|-1|#debate Sócrates disse o que quis e respondeu ao que lhe apeteceu
2011-05-16\2011-05-17|70223521460125600|20597486|jsocrates|sócrates|-1|#debate sócrates está maçado... a modos que aborrecido. é bom sinal.
2011-05-16\2011-05-17|70220120479379400|20856213|jsocrates|sócrates|-1|#Debate Sócrates fala de austeridade, curiosamente pq lhe dá alguma credibilidade....Mas ñ tínhamos sido os primeiros a sair da crise!!?
2011-05-16\2011-05-17|70217943862083500|19034835|jsocrates|sócrates|-1|#debate sócrates insiste na postura de alguém que nada tem a ver com o que aconteceu a portugal, com o buraco em que estamos enfiados
2011-05-16\2011-05-17|70216522487959500|3310571|jsocrates|sócrates|-1|#debate Sócrates insiste na rábula do programa. E ainda ninguém se lembrou de trazer o do PS?
2011-05-16\2011-05-17|70224203223285700|58832411|jsocrates|sócrates|-1|#DEBATE Sócrates já ataca Clara de Sousa, está desesperado
2011-05-16\2011-05-17|70216639009927100|17477169|jsocrates|sócrates|-1|#debate Sócrates repete o númerozinho do programa do adversário na mão... Falta de imaginação.
2011-05-16\2011-05-17|70225865870548900|22280318|jsocrates|sócrates|-1|#debate Sócrates tem uma cassete: ñ havia necessidade de crise política, ñ baixará a TSU, ñ baixará salários. Tudo mentira.
2011-05-16\2011-05-17|70229898899365800|17477169|jsocrates|sócrates|-1|#sic Sócrates que tanto enche a boca com o estado social, tb podia dizer o que fez ao cheque-bebé que prometeu...
2011-05-16\2011-05-17|70502772163883000|19896045|jsocrates|sócras|-1|A armadilha Sócrates: 1 vez que ninguém aceita governar com ele, então dar a vitória ao PS prolongar a crise política q Sócras tanto critica
2011-05-16\2011-05-17|70460490031181800|125990752|jsocrates|sócrates|-1|A candidatura à Ryder Cup 2018: mais um flop do querido" ex- ministro Sócrates,  Manuel Pinho!"
2011-05-16\2011-05-17|70259204434300900|145830343|jsocrates|sócrates|-1|A governação de Sócrates/PS nos últimos anos foi o maior atentado de que há memória contra o Estado Social. Esse é o seu verdadeiro legado.
2011-05-16\2011-05-17|70510001604665300|18803751|ppcoelho|passos coelho|-1|A impreparação está nos detalhes: Passos Coelho (quando nem sequer Strauss-Khan tinha ainda sido levado a tribun... http://bit.ly/msTXQv
2011-05-16\2011-05-17|70420129145569200|49195175|flouca|francisco louçã|-1|A ouvir Francisco Louçã na @TSFRadio em modo de demagogia activa. É uma pena não poder telefonar para o fórum.
2011-05-16\2011-05-17|70227034198130600|45150700|jsocrates|sócrates|-1|a sério.. alguém me explica como é que o sócrates pode vir a ser reeleito?
2011-05-16\2011-05-17|70223715601874900|19393139|jsocrates|sócrates|-1|A solução para Sócrates resolver a falta de competividade é a fórmula que usou nos últimos anos: + 250 mil desempregados
2011-05-16\2011-05-17|70249681317404600|87065252|ppcoelho|passos coelho|-1|Acabei de ler num forum que o Prof. Doutor Passos Coelho ia acabar c o Min. Cultura".. PN sei o q emais estupido. se o inicio, s o fim."
2011-05-16\2011-05-17|70463890907074500|24399244|ppcoelho|ppc|-1|Acerca das Novas Oportunidades: de duas uma, ou PPC não quer mesmo ganhar eleições, ou estamos perante o mais inábil político EVER
2011-05-16\2011-05-17|70220085079449600|14085181|jsocrates|sócrates|-1|Alguém deve ter traduzido o papel ao Sócrates, o inglês técnico não chega para perceber o acordo #debate
2011-05-16\2011-05-17|70215869917175800|102773210|jsocrates|sócrates|-1|alteração de perímetro, diz alguma coisa? RT @pedro_sales: o q Sócrates ñ explica. 1 ano d austeridade deixou contas públicas em pior estado
2011-05-16\2011-05-17|70241939290734500|17365528|jsocrates|sócrates|-1|Ao pé dos números de Coelho, a pasta vazia de Sócrates parece uma brincadeira de meninos...
2011-05-16\2011-05-17|70537333350473700|233292368|pportas|paulo portas|-1|Cada vez mais previsível...Paulo Portas quer virar a página" do "pesadelo" da governação PS na agricultura http://tinyurl.com/6akwak4"
2011-05-16\2011-05-17|70222237659176900|22321740|jsousa|jerónimo de sousa|-1|Cada vez que vejo o Jerónimo de Sousa num #debate dá-me a impressão que foram buscar um velhote ao acaso ao Jardim da Parada.
2011-05-16\2011-05-17|70221618303078400|31155470|jsocrates|josé sócrates|-1|Com tanta inauguração... RT @G_L É de tanto trabalhar RT @RitaMarrafadeC: José Sócrates parece cansado...
2011-05-16\2011-05-17|70507580908240800|140091998|jsocrates|sócrates|-1|Conheço apenas a minha ignorância." Sócrates"
2011-05-16\2011-05-17|70490953835757500|34076997|jsocrates|sócrates|-1|Cortes de árvores na ressidência PM acordam vizinhos", JACerejo. Mais 1 escândalo! O Sócrates não deixa dormir os vizinhos. Como o Hitler."
2011-05-16\2011-05-17|70225606347980800|23228715|jsocrates|socrates|-1|cuidado desviem o olhar, socrates começou a hipnotizar o pessoal #debate
2011-05-16\2011-05-17|70223324579495900|19839719|jsocrates|sócrates|-1|Definitivamente o azeite está na moda, até jà é trunfo eleitoral para Sócrates.
2011-05-16\2011-05-17|70499046770479100|188242820|pportas|portas|-1|DN:Portas não fecha a porta ao PS".... Eles olham pá direita e pisca pisca... eles olham para a esquerda e pisca pisca...."
2011-05-16\2011-05-17|70542313729957800|125990752|jsocrates|josé sócrates|-1|É lindo ouvir Daniel Oliveira falar da Não democracia na Madeira. Acusa a Jardim de coisas q já vimos a José Sócrates. Mas aí, faz o frete!
2011-05-16\2011-05-17|70249675688656800|271478841|jsocrates|socrates|-1|e q n m apetece nd q o atrasado mental do socrates ganhe as eleiçoes
2011-05-16\2011-05-17|70223548374990800|14472794|jsocrates|sócrates|-1|Efectivamente Jerónimo e Sócrates vivem noutro país...só pode...
2011-05-16\2011-05-17|70556236269101000|8665852|jsocrates|sócrates|-1|Eleições: Sócrates é o campeão de mudar de opinião -- Menezes http://ow.ly/1cIwps
2011-05-16\2011-05-17|70270336733687800|19083439|jsocrates|sócrates|-1|Em breve dirá que o branqueamento do Face Oculta e Freeport foi vergonhoso RT @helderlib Marinho a acusar o Sócrates!!! Extraordinário!
2011-05-16\2011-05-17|70227090011717600|20428049|jsocrates|sócrates|-1|Em duas palavras: povo português RT @jpmagallanes: a sério.. alguém me explica como é que o sócrates pode vir a ser reeleito?
2011-05-16\2011-05-17|70236222877995000|7988062|jsocrates|socrates|-1|entao o socrates so agora é q descobriu q nao existe tradução oficial do memorando? teve que ser um blog a faze-lo http://bit.ly/jUpOkJ
2011-05-16\2011-05-17|70239520985063400|189737516|jsocrates|sócrates|-1|Está a candidatar-se ao Nobel, este... RT “@Publico: Sócrates: “Quem ganha as eleições é que vai para o Governo” http://t.co/N6LOoxm”
2011-05-16\2011-05-17|70411640511795200|296076621|pportas|paulo portas|-1|Estava aqui a pensar que político português me podia surpreender mais que o Strauss Kahn do FMI. Já sei, o Paulo Portas com um carneirinho.
2011-05-16\2011-05-17|70225760413171700|27867641|jsousa|jeronimo|-1|Este #debate entre Socrates e Clara foi interessante. Afinal o pau-de-cabeceira é o jeronimo.
2011-05-16\2011-05-17|70520712259043300|51679632|jsocrates|socrates|-1|Fiquei aqui com a ideia q/na perspectiva de J. Socrates a trapalhice concretizada p/ELLES" é irreversível ...… (cont) http://deck.ly/~N6vUz"
2011-05-16\2011-05-17|70221622790987700|17169390|jsocrates|sócrates|-1|Foi aqui que Sócrates, com o seu inglês técnico, leu o memorando: http://tinyurl.com/6hb9744
2011-05-16\2011-05-17|70256171767959500|12062392|jsocrates|sócrates|-1|Frase da semana: Ponham o Sócrates a governar o deserto do Sahara, e passados seis meses os Saaráuis estarão a precisar de importar areia""
2011-05-16\2011-05-17|70507106662490100|5397|jsocrates|socrates|-1|Isto do socrates e o passos coelho andarem a medir pilinhas já não tem piada. E o foste tu que te cagaste, não fui eu" tb não...."
2011-05-16\2011-05-17|70421326631927800|3373791|ppcoelho|passos coelho|-1|Já há algum site para agregar as gaffes de Passos Coelho?
2011-05-16\2011-05-17|70276722918031300|266887866|jsocrates|sócrates|-1|Já não me surpreende que o animal Sócrates vença novamente. Este país está podre e só vai perceber isso quando lhe roerem até ao osso.
2011-05-16\2011-05-17|70227902230302700|22280318|jsocrates|sócrates|-1|José Sócrates consegue fazer um debate inteiro a criticar tudo o que tem feito e vai continuar a fazer!
2011-05-16\2011-05-17|70452281572728800|21817509|jsocrates|sócrates|-1|José Sócrates é parte do problema, ja não faz parte da solução !
2011-05-16\2011-05-17|70219490029355000|20712514|jsocrates|sócrates|-1|José Sócrates parece cansado...
2011-05-16\2011-05-17|70484991540346800|19604745|ppcoelho|passos coelho|-1|Mais uma argolada de Passos Coelho! “@Publico: PSD acusa Sócrates de distribuir diplomas “a granel” a troco de votos” http://t.co/qjxs99b
2011-05-16\2011-05-17|70230693262794700|19722435|jsocrates|sócrates|-1|Mas isso não é novidade @antonioproa:  #sic Sócrates desdiz aquilo que afirmou anteriormente...""
2011-05-16\2011-05-17|70508346150621100|23469895|jsocrates|sócrates|-1|Ñ te preocupes @passoscoelho, o PM insultou 9,5 milhões RT @revistaSABADO Sócrates: Passos insultou 500 mil portugueses http://bit.ly/lcJgKa
2011-05-16\2011-05-17|70418138881200100|20843626|ppcoelho|passos coelho|-1|na terra do Passos Coelho está um tempo de merda"!"
2011-05-16\2011-05-17|70444111144030200|47622979|jsocrates|sócrates|-1|Não acreditava em Sócrates, nem que ele fosse um canário numa mina.
2011-05-16\2011-05-17|70229124957995000|69663389|jsocrates|sócras|-1|Não sei quem é a repórter que está a fazer o flash-interview do sócras mas quer-me parecer que vão fazer queixinhas dela ao big boss...
2011-05-16\2011-05-17|70217300682350500|16349463|jsocrates|sócrates|-1|Não vás por aí #sócrates
2011-05-16\2011-05-17|70225929493942200|92843870|jsocrates|sócrates|-1|não! RT @jorgelc: alguém percebeu alguma coisa do minuto final de sócrates?
2011-05-16\2011-05-17|70270000308568000|17365528|ppcoelho|passos coelho|-1|No final da campanha, Passos Coelho vai lançar um Greatest Hits?
2011-05-16\2011-05-17|70215803076743100|14085181|jsocrates|sócrates|-1|No primeiro round o Jerónimo levou o Sócrates ao tapete com o cheque bébé e a redução dos abonos família #debate
2011-05-16\2011-05-17|70217203928150000|15346939|jsousa|jerónimo de sousa|-1|Nota-se que o Jerónimo de Sousa está sem pedalada" para as eleições. Respostas fracas e um pouco ao lado do que é perguntado."
2011-05-16\2011-05-17|70206122761519100|14321207|jsocrates|sócrates|-1|O #Sócrates anda sempre sorrir para os jornalistas...coisas das eleições não é engenheiro? \ já sabem que eu sou @ppdpsd
2011-05-16\2011-05-17|70391579617140700|52175019|jsocrates|socrates|-1|O Americano: We have Barack Obama, Stevie Wonder, Bob Hope, and Johnny Cash O Português: We have José Socrates, no wonder, no hope, no cash
2011-05-16\2011-05-17|70223046375505900|197927483|jsocrates|josé sócrates|-1|O candidato José Sócrates" pegou."
2011-05-16\2011-05-17|70220902645776300|20973069|jsocrates|socrates|-1|O fato de Jeronimo foi feito num alfaiate dos Anjos em benefício da produção nacional, o de Socrates foi importado e o FMI pagou-o #debate
2011-05-16\2011-05-17|70221841993711600|24689024|jsousa|jerónimo de sousa|-1|O Jerónimo de Sousa dá-me sono! não me admiro que haja sempre deputados a dormir na assembleia!
2011-05-16\2011-05-17|70498862489546700|140510284|jsocrates|pinóquio|-1|O Obama de Massamá acabou de perder as eleições com o Pinóquio com aquela tirada sobre as Novas Oportunidades. God help us, God help us all.
2011-05-16\2011-05-17|70242768873725900|21284519|jsocrates|sócrates|-1|O Presidente do FMI também irá fod.r os portugueses e o Sócrates ainda lhe faz 1 vénia...
2011-05-16\2011-05-17|70215546142064600|14903044|jsocrates|sócrates|-1|o que Sócrates não explica. 1 ano de profunda austeridade deixou contas públicas em pior estado
2011-05-16\2011-05-17|70228893839261600|23653807|jsocrates|sócrates|-1|O Sócrates é mesmo o verdadeiro vendedor de banha da cobra". Não perde uma oportunidade para fazer propaganda!!"
2011-05-16\2011-05-17|70271533175668700|28800611|jsocrates|socrates|-1|Ora bem, quem é que aqui vê Mad Men? ( Para além do Socrates, q n é de fiar)
2011-05-16\2011-05-17|70225553537507300|206847322|jsocrates|socras|-1|Ou a minha box esta a dar as ultimas ou o Zé socras é um cyborg
2011-05-16\2011-05-17|70422075382317000|200064962|ppcoelho|passos coelho|-1|ouch! RT @PauloQuerido: Mais um fora de Passos Coelho: Dr. Passos Coelho, apresentamos-lhe o Eng. Roberto Carneiro" http://pqne.ws/iMhIyj"
2011-05-16\2011-05-17|70215743458918400|271558274|jsocrates|socrates|-1|parece que o passos coelho esta la o socrates so fala nele lol
2011-05-16\2011-05-17|70265933389762500|34076997|jsocrates|sócrates|-1|Passos Coelho quer extinguir ministério da Cultura. Mais uma mentira de Sócrates.
2011-05-16\2011-05-17|70404605288263600|17306424|ppcoelho|líder do psd|-1|Passos Coelho, o «Obama de Massamá» - descobri no «i» há segundos. O líder do PSD já trocou «Yes we can» por «A-fri-canz!»
2011-05-16\2011-05-17|70480987284439000|23263743|ppcoelho|passos coelho|-1|Pedro Passos Coelho diz 'estás pouco boa, estás' a empregada de mesa para se colar ao presidente do FMI http://bit.ly/koD14t
2011-05-16\2011-05-17|70280432712822700|2509551|ppcoelho|passos coelho|-1|pior, dependerá directamente de passos coelho! “@joaomiranda: Sem ministério da cultura desaparecerá a cultura em Portugal”
2011-05-16\2011-05-17|70496239111766000|299875839|jsocrates|socrates|-1|Por o Socrates a gerir 78 mil milhoes e como promover o Bibi a chefe dos escuteiros
2011-05-16\2011-05-17|70539796061229000|54627593|jsocrates|sócrates|-1|Pôr o Sócrates a gerir os 78 mil milhões.. É como promover o Bibi a chefe dos escuteiros..
